project_id,esco_id,esco_label,esco_description,nace_code,pad_occupations,pad_activities,pad_skills,pad_quotes,esco_uri
P075941,a74f6c51-37e5-423e-aa5b-044e98663027,web content manager,"Web content managers curate or create content for a web platform according to the long-term strategic goals, policies and procedures for an organisation's online content or their customers. They control and monitor compliance with standards, legal and privacy regulations and ensure web optimisation. They are also responsible for integrating the work of writers and designers to produce a final layout which is compatible with corporate standards.","http://data.europa.eu/ux2/nace2.1/5819,
http://data.europa.eu/ux2/nace2.1/621","""Web Content Manager""","""Post all public project documents, including environmental and social impact reports, online on a dedicated project website.""","""post public documents online on a dedicated website"", ""manage online disclosure of environmental and social impact reports""","Annex 9: Communication Strategy: ""The RRFHP will adhere to the Bank's Access to Information Policy, and all public documents involving the project, including environmental and social impact reports, will be posted online on a dedicated website -www.worldbank.org/Rusomo.""",http://data.europa.eu/esco/occupation/a74f6c51-37e5-423e-aa5b-044e98663027
P075941,a9068f84-cecd-4cbb-9acb-e20c714435ec,concrete finisher,"Concrete finishers work with binding agents like cement and concrete. They put up any removable forms and pour concrete into the forms. They then execute one or several actions to finish the concrete: cutting, screeding or levelling, compacting, smoothing, and chamfering to prevent chipping.",http://data.europa.eu/ux2/nace2.1/410,"""Concrete Worker"", ""Tunnel Concrete Finisher""","""Execute concrete works for the power plant complex structures."", ""Perform concreting of the tunnel invert in areas of larger faults.""","""carry out concrete works for the power plant complex structures"", ""concrete the tunnel invert in areas of larger faults""","III. PROJECT DESCRIPTION: ""This component comprises all excavation/earth works, tunneling and concrete for the power plant complex structures, including a barrage and gated spillway, intake works and diversion/power canal, surface powerhouse, access roads and construction site facilities such as offices and housing."", Annex 2: Detailed Project Description: ""In areas where minor  faults intersect the  tunnel, the  friable, erodible fault material as well  as the  adjacent rock  affected by the fault will  be protected by means of  an anchored  shotcrete layer and welded  wire-mesh  reinforcement. If a fault zone of  greater thickness is  encountered, or  if poor  rock  conditions are  encountered over  a  large span  of the  crown such  that rock  bolts and  reinforced shotcrete do not  ensure  long-term stability, steel sets and lagging will be required in  addition to  the  preceding. It  is  anticipated that concreting of  the  invert will also be  required in  areas of  larger faults.""",http://data.europa.eu/esco/occupation/a9068f84-cecd-4cbb-9acb-e20c714435ec
P075941,a950e88b-cb5e-4a7d-8a94-3f9460b487d7,compliance engineer,"Compliance engineers strive to keep the highest compliance of systems with engineering specifications. They can exert compliance in a varied array of engineering fields including mechanical, electrical, electronical systems. They ensure the engineering complies with regulations, safety measures, and internal directives.","http://data.europa.eu/ux2/nace2.1/7112,
http://data.europa.eu/ux2/nace2.1/712","""Third-Party Technical Auditor""","""Carry out regular third-party technical audits of safeguards measures to ensure compliance with safeguard policies.""","""perform third-party technical audits of safeguards measures"", ""ensure compliance with safeguard policies""","V. KEY RISKS AND MITIGATION MEASURES: ""A regular  third party  technical audit  of  safeguards measures  will also  ensure  compliance  with  safeguard policies.""",http://data.europa.eu/esco/occupation/a950e88b-cb5e-4a7d-8a94-3f9460b487d7
P075941,aad7819e-d62e-41de-a594-9f2be186a6c2,transport engineer,"Transport engineers design and set the engineering specifications for the construction and development of roadways and transport infrastructure. They apply engineering concepts and knowledge for developing sustainable and efficient modes of transportation ranging from roads to canals, railways, and airports.","http://data.europa.eu/ux2/nace2.1/7112,
http://data.europa.eu/ux2/nace2.1/421","""Road Construction Engineer""","""Construct a new two-lane roadway on the upstream side of the dam/spillway structures.""","""construct a two-lane roadway on the upstream side of the dam/spillway structures""","Annex 2: Detailed Project Description: ""A new two-lane roadway  will be constructed on  the  upstream  side of  the dam/spillway structures.""",http://data.europa.eu/esco/occupation/aad7819e-d62e-41de-a594-9f2be186a6c2
P075941,ac1fc6a9-70d2-475c-8fa0-82ef83830968,environmental engineer,"Environmental engineers integrate environmental and sustainable measures in the development of projects of various natures. They seek to preserve natural resources and natural sites. They work together with engineers from other fields to envision all the implications that projects might have in order to design ways to conserve natural reserves, prevent pollution, and deploy sanitary measures.","http://data.europa.eu/ux2/nace2.1/7112,
http://data.europa.eu/ux2/nace2.1/712,
http://data.europa.eu/ux2/nace2.1/8412,
http://data.europa.eu/ux2/nace2.1/7499,
http://data.europa.eu/ux2/nace2.1/9499","""Environmental Specialist""","""Provide environmental assessment and management expertise within the Rusumo Project Implementation Unit for ESMP implementation.""","""environment specialist"", ""implementation of ESMP""","Annex 3: Implementation Arrangements Regional Rusumo Falls Hydroelectric Project: ""The Unit's oversight capability will be reinforced with  a Project Manager  as head of  the Unit,  senior  project engineers  (civil, electrical and mechanical), a quantity surveyor, environment  and social specialists, a procurement specialist, a  financial-management specialist, an  accounts-and-logistics assistant, a communications  specialist and other technical staff.""",http://data.europa.eu/esco/occupation/ac1fc6a9-70d2-475c-8fa0-82ef83830968
P075941,ac37627c-a999-4779-997e-9795cc4f9a3d,power distribution engineer,"Power distribution engineers design and operate facilities which distribute power from the distribution facility to the consumers. They research methods for the optimisation of power distribution, and ensure the consumers' needs are met. They also ensure compliance to safety regulations by monitoring the automated processes in plants and directing workflow.","http://data.europa.eu/ux2/nace2.1/7112,
http://data.europa.eu/ux2/nace2.1/3514,
http://data.europa.eu/ux2/nace2.1/4222","""Power Engineer"", ""Institutional Specialist in the Electricity Sector""","""member of the core implementation-support team providing field-based implementation support on power-sector technical issues"", ""provide support to the implementation-support team on institutional aspects of the electricity sector""","""provide field-based implementation support"", ""provide power-sector technical support"", ""provide support to the implementation-support team"", ""provide institutional expertise in the electricity sector""","Annex 8: Implementation Support Team: ""The core implementation-support team will consist of a task team leader (TTL), a power engineer, an environmental safeguard specialist, a social-safeguards specialist, a procurement specialist, and a financial-management specialist."", Annex 8: Implementation Support Team: ""This  team will  receive  support  from an institutional specialist in the  electricity sector, an electromechanical engineer, a civil engineer, a resettlement specialist, a hydropower specialist, a legal  advisor, a water  resources specialist, a communications specialist, and  a monitoring  and  evaluation (M&amp;E) specialist.""",http://data.europa.eu/esco/occupation/ac37627c-a999-4779-997e-9795cc4f9a3d
P075941,b89ba3a8-f03a-46b8-ac54-c87d7204aad0,spokesperson,Spokespeople speak on behalf of companies or organisations. They use communication strategies to represent clients through public announcements and conferences. They promote their clients in a positive light and work to increase an understanding of their activities and interests.,http://data.europa.eu/ux2/nace2.1/733,"""Media Liaison Officer""","""Communicate in real time with country teams and adhere to the Bank's guidelines for interacting with media.""","""communicate effectively in real time"", ""adhere to the Bank's guidelines for interacting with media""","Annex 9: Communication Strategy: ""The high-risk aspects of this project and the immediacy of the news cycle require that country teams in Burundi, Rwanda and Tanzania and Washington based teams communicate effectively in real time and strictly adhere to the Bank's guidelines for interacting with media.""",http://data.europa.eu/esco/occupation/b89ba3a8-f03a-46b8-ac54-c87d7204aad0
P075941,b915ab4a-f7b1-44bc-a5a4-585e91d31dfd,property acquisitions manager,Property acquisitions managers ensure land or property acquisitions transactions. They liaise with relevant stakeholders concerning financial aspects and risks arising from the acquisition of property. Property acquisitions managers ensure compliance with legal requirements for purchasing property and take care of all documentation and closure techniques needed.,http://data.europa.eu/ux2/nace2.1/6831,"""Land Acquisition Specialist""","""Manage site acquisition activities required during project preparation and set-up.""","""site acquisition""","III. PROJECT DESCRIPTION: ""The project period will be about seven (7) years, from approval and will include: (i) 12 months of final designs, contractor selection, site acquisition and related activities, (ii) 45 months construction period and (iii) 24 months covering the initial defects liability period.""",http://data.europa.eu/esco/occupation/b915ab4a-f7b1-44bc-a5a4-585e91d31dfd
P075941,bafbc672-0ad9-41af-9de8-db0c91a24f9b,billing clerk,"Billing clerks create credit memos, invoices and monthly customer statements and issue them to customers by all necessary means. They update customer files accordingly.",http://data.europa.eu/ux2/nace2.1/821,"""Billing and Collections Officer (Utility)""","""Settle monthly invoices of capacity and energy charges issued by Rusumo Power Company Limited within stipulated payment terms.""","""settle monthly invoices of capacity and energy charges within 30 days""","Annex 5: Economic and Financial Analysis Implementation Arrangements: ""The three off-takers will have a contractual obligation, under their respective PPAs, to settle RPCL's monthly invoices of capacity and energy charges within 30 days of their issuance.""",http://data.europa.eu/esco/occupation/bafbc672-0ad9-41af-9de8-db0c91a24f9b
P075941,bea99fea-0383-4c63-b944-70d4799de2c5,project manager,"Project managers oversee the project on a daily basis and are responsible for delivering high-quality results within the identified objectives and constraints, ensuring the effective use of the allocated resources. They are responsible for risk and issue management, project communication and stakeholder management. Project managers perform the activities of planning, organising, securing, monitoring and managing the resources and work necessary to deliver specific project goals and objectives in an effective and efficient way.","http://data.europa.eu/ux2/nace2.1/702,
http://data.europa.eu/ux2/nace2.1/701","""Project Manager"", ""Project Manager (Rusumo Falls Project Implementation Unit)"", ""Project Management Specialist"", ""Project Scheduler""","""Support the set-up operations of the Rusumo Power Company Limited and the NELSAP Rusumo Project Implementation Unit."", ""Implement and manage Component A (the Power Plant Complex) on behalf of the RPCL and serve as head of the RPIU."", ""Provide overall project management and supervision of procurement, design, construction and preparation for operation and maintenance of the power plant complex and transmission lines on behalf of the implementing unit."", ""Head the Rusumo Project Implementation Unit and provide unit oversight capability during project implementation."", ""Prepare a master project implementation schedule covering the power plant and transmission lines and closely monitor it during project implementation.""","""support the set-up operations of the Rusumo Power Company Limited and NELSAP Rusumo Project Implementation Unit"", ""implement and manage Component A"", ""head the Unit"", ""provide overall project management"", ""supervise procurement"", ""supervise design"", ""supervise construction"", ""prepare for operation and maintenance"", ""head of the Unit"", ""oversight capability"", ""prepare master project implementation schedule"", ""closely monitor the schedule during project implementation""","III. PROJECT DESCRIPTION: ""This component will also finance staff costs to support the set-up operations of the Rusumo Power Company Limited (RPCL) and NELSAP Rusumo Project Implementation Unit (RPIU) including a project manager, senior engineers (civil, electrical and mechanical), a quantity surveyor, a safeguards team, a procurement specialist, a financial management specialist, accounts and logistics assistant, a communications specialist and other technical staff."", IV. IMPLEMENTATION: ""Component A of the project (the Power Plant Complex) will be implemented and managed by NELSAP's Rusumo Falls Project Implementation Unit (RPIU) on behalf of the RPCL. The RPIU will be staffed with a project manager as head of the Unit."", V. KEY RISKS AND MITIGATION MEASURES: ""61. The RPIU  will be  supported by the  Owner's  Engineer and will be  responsible for: (i)  overall project management and supervision of the procurement, design, construction and  preparation for operation  and  maintenance of  the power  plant  complex  and transmission lines; and (ii) coordination of the implementation of the Environmental and Social Management  Plan (ESMP) and  the  Resettlement Action  Plan  (RAP)."", Annex 3: Implementation Arrangements Regional Rusumo Falls Hydroelectric Project: ""The Unit's oversight capability will be reinforced with  a Project Manager  as head of  the Unit,  senior  project engineers  (civil, electrical and mechanical), a quantity surveyor, environment  and social specialists, a procurement specialist, a  financial-management specialist, an  accounts-and-logistics assistant, a communications  specialist and other technical staff."", Annex 4: Operational Risk Assessment Framework (ORAF): ""A master project implementation schedule (covering the  power plant and  transmission lines) will be  prepared and  closely monitored during project implementation.""",http://data.europa.eu/esco/occupation/bea99fea-0383-4c63-b944-70d4799de2c5
P075941,bfe142b9-a049-4d41-89c4-fd2f34ac56b6,accounting assistant,"Accounting assistants record and report ticketing accounting situations to the accountant they work with, verify deposits and prepare daily reports and income. They arrange authorised refund vouchers, maintain the returned check accounts and communicate with ticketing managers concerning about any issues with ticketing systems.",http://data.europa.eu/ux2/nace2.1/692,"""Accounts and Logistics Assistant""","""Support day-to-day accounts maintenance and logistics record-keeping for the Rusumo Project Implementation Unit.""","""accounts-and-logistics assistant""","Annex 3: Implementation Arrangements Regional Rusumo Falls Hydroelectric Project: ""The Unit's oversight capability will be reinforced with  a Project Manager  as head of  the Unit,  senior  project engineers  (civil, electrical and mechanical), a quantity surveyor, environment  and social specialists, a procurement specialist, a  financial-management specialist, an  accounts-and-logistics assistant, a communications  specialist and other technical staff.""",http://data.europa.eu/esco/occupation/bfe142b9-a049-4d41-89c4-fd2f34ac56b6
P075941,c25b3700-6095-42b7-99fc-b87dc326c044,agricultural scientist,"Agricultural scientists research and study soil, animals and plants with the objective of improving agricultural processes, the quality of agricultural products or the impact of agricultural processes on the environment. They plan and implement projects such as development projects on behalf of clients or institutions.","http://data.europa.eu/ux2/nace2.1/721,
http://data.europa.eu/ux2/nace2.1/015,
http://data.europa.eu/ux2/nace2.1/012,
http://data.europa.eu/ux2/nace2.1/016,
http://data.europa.eu/ux2/nace2.1/013,
http://data.europa.eu/ux2/nace2.1/011,
http://data.europa.eu/ux2/nace2.1/014","""Agricultural Trainer / Agricultural Extension Officer""","""Provide agricultural training for intensification of production as part of the livelihood restoration program.""","""agricultural training for intensification of production"", ""implement agricultural livelihood training""","VI. APPRAISAL SUMMARY: ""In addition all affected households will be entitled to participate in a livelihood restoration program which will include financial training for the sustainable utilization of cash compensation, agricultural training for intensification of production and business skill training.""",http://data.europa.eu/esco/occupation/c25b3700-6095-42b7-99fc-b87dc326c044
P075941,c3aae59e-1441-4b3e-bdd1-6da50dc7cf42,bookkeeper,"Bookkeepers record and assemble the day-to-day financial transactions of an organisation or company, consisting usually of sales, purchases, payments and receipts. They ensure all financial transactions are documented in the appropriate (day) book and general ledger, and that they are balanced out. Bookkeepers prepare the recorded books and ledgers with financial transactions for an accountant to then analyse balance sheets and income statements.",http://data.europa.eu/ux2/nace2.1/692,"""Project Finance Officer""","""Maintain daily project books of accounts and records for the project under the Finance and Administration Manager.""","""in charge of the daily maintenance of the project books of accounts and records""","Annex 3: Implementation Arrangements Regional Rusumo Falls Hydroelectric Project: ""This manager will be assisted by a Project Finance Officer who will be in charge of the daily maintenance of the project books of accounts and records.""",http://data.europa.eu/esco/occupation/c3aae59e-1441-4b3e-bdd1-6da50dc7cf42
P075941,c6196b21-20f9-4608-83fb-6f143afc740d,geologist,"Geologists research the materials that form the earth. Their observations depend on the purpose of the research. Depending on their specialisation, geologists study how the Earth has been shaped over time, its geological layers, the quality of minerals for mining purposes, earthquakes and volcanic activity for private services, and similar phenomena.","http://data.europa.eu/ux2/nace2.1/721,
http://data.europa.eu/ux2/nace2.1/7112,
http://data.europa.eu/ux2/nace2.1/712,
http://data.europa.eu/ux2/nace2.1/B,
http://data.europa.eu/ux2/nace2.1/4313","""Geologist (Geological Baseline Reporting)""","""Prepare geological baseline reports to be provided to prospective bidders' contractors.""","""prepare geological baseline reports"", ""provide geological data to prospective bidders' contractor""","VI. APPRAISAL SUMMARY: ""Also, geological baseline reports will be prepared and provided to the prospective bidder's contractor.""",http://data.europa.eu/esco/occupation/c6196b21-20f9-4608-83fb-6f143afc740d
P075941,c6bd511a-d966-4df9-a48e-4f800354f268,operations manager,"Operations managers plan, oversee and coordinate the daily operations of production of goods and provision of services. They also formulate and implement company policies and plan the use of human resources and materials.",http://data.europa.eu/ux2/nace2.1/701,"""Operations and Management Contractor""","""Be appointed as the Operations and Management contractor as an intermediate result to manage operations and ensure quality implementation of safeguards.""","""appointment as the Operations and Management contractor""","IV. IMPLEMENTATION: ""Intermediate results to monitor performance include construction progress, appointment of the Operations and Management contractor and quality implementation of the ESMP.""",http://data.europa.eu/esco/occupation/c6bd511a-d966-4df9-a48e-4f800354f268
P075941,c89afd9a-7dad-4bae-9315-5fcadd9ad8b6,electricity distribution technician,"Electricity distribution technicians construct and maintain electric power transmission and distribution systems. They maintain and repair powerlines, compliant with safety regulations.",http://data.europa.eu/ux2/nace2.1/3514,"""High Voltage Transmission Line Installer""","""Install and connect transmission lines from the transformers to the substation.""","""install and connect transmission lines from transformers to substation""","Annex 2: Detailed Project Description: ""The transmission lines from  the transformers will  connect the  powerhouse  to  the substation.""",http://data.europa.eu/esco/occupation/c89afd9a-7dad-4bae-9315-5fcadd9ad8b6
P075941,c8b296be-54ae-48cf-be21-031fa8457937,supply chain assistant,"Supply chain assistants work closely together with managers in the operations processes, namely purchasing, manufacturing, and distribution processes. They help with administrative and pragmatic follow up of actions such as invoicing, drafting and preparation of contracts and purchasing orders, reconciliation of inventory against documents, and communication with distribution channels.",http://data.europa.eu/ux2/nace2.1/702,"""Accounts and Logistics Assistant""","""Provide accounts and logistics assistance to support project set-up and operations.""","""support the set-up operations of the Rusumo Power Company Limited and NELSAP Rusumo Project Implementation Unit as accounts and logistics assistant""","III. PROJECT DESCRIPTION: ""This component will also finance staff costs to support the set-up operations of the Rusumo Power Company Limited (RPCL) and NELSAP Rusumo Project Implementation Unit (RPIU) including a project manager, senior engineers (civil, electrical and mechanical), a quantity surveyor, a safeguards team, a procurement specialist, a financial management specialist, accounts and logistics assistant, a communications specialist and other technical staff.""",http://data.europa.eu/esco/occupation/c8b296be-54ae-48cf-be21-031fa8457937
P075941,c94f3565-d987-431f-a46b-6f4e018e0bd7,programme manager,"Programme managers coordinate and oversee several projects working simultaneously. They ensure workability and compatibility among projects ensuring that overall, each one of the projects under the management of project managers, turn out profitable and leveraging one to the other.",http://data.europa.eu/ux2/nace2.1/701,"""Commissioner for Energy (Ministry of Energy official)""","""Serve on the Project Steering Committee to provide oversight and ensure timely and quality project implementation.""","""provide an oversight function"", ""ensuring timely and quality project implementation""","IV. IMPLEMENTATION: ""To continue with this oversight role, there will be a Project Steering Committee (PSC) to oversee the functions of the RPIU, charged with the responsibility of ensuring timely and quality project implementation. The PSC will provide an oversight function and shall be comprised of an official from the Ministry of Energy (at the level of Commissioner for energy) and the utility (at least at the level of head of the generation department) from each of the respective beneficiary countries.""",http://data.europa.eu/esco/occupation/c94f3565-d987-431f-a46b-6f4e018e0bd7
