extraction_id,identified_occupation,industry,activity_description_in_pad,skills_needed_for_activity,source_material_quote,project_id,section_id,pad_id,combined_text,match_1_esco_id,match_1_occupation,match_1_score,match_2_esco_id,match_2_occupation,match_2_score,match_3_esco_id,match_3_occupation,match_3_score,match_4_esco_id,match_4_occupation,match_4_score,match_5_esco_id,match_5_occupation,match_5_score,match_6_esco_id,match_6_occupation,match_6_score,match_7_esco_id,match_7_occupation,match_7_score,match_8_esco_id,match_8_occupation,match_8_score,match_9_esco_id,match_9_occupation,match_9_score,match_10_esco_id,match_10_occupation,match_10_score
10,Water Resources Management Specialist (Kagera River Basin),Water resources management and hydrology,"Ensure coordinated water use management during post-construction operation, ensure compliance with water rights, oversee maintaining water levels and report water use, quality and quantity.","['ensuring compliance with the water use rights', 'providing oversight in maintaining water levels', 'facilitate governmental and inter-governmental actions', 'report water use including water quality and quantity']","To ensure coordinated management of  the  water  use  during  the  post-construction a d operation of  the  Power Plant  Complex,  a Water Resources  Technical  Sub-committee will  be established to ensure  adequate  water  resources management  of  the  Kagera River  Basin.  The Water Resources  Technical  Sub-committee  shall be responsible for:  (i)  ensuring  compliance with  the  water  use rights and related aspects; (ii) providing oversight in maintaining water  levels to  ensure  that the  natural life, water  quality and quantity and the  Kagera River Basin-wide surroundings, are not adversely  affected by the Project; and (iii) facilitating governmental  and  inter-governmental actions that may be  required, including consistent periodic and  accurate reporting to  the  Kagera  River  Basin  Management  Team of  the  water use,  including the  water  quality and  quantity.",P075941,3,126,"Water Resources Management Specialist (Kagera River Basin) Water resources management and hydrology Ensure coordinated water use management during post-construction operation, ensure compliance with water rights, oversee maintaining water levels and report water use, quality and quantity. ensuring compliance with the water use rights, providing oversight in maintaining water levels, facilitate governmental and inter-governmental actions, report water use including water quality and quantity",3002,water engineer,0.85196215,1053,hydrologist,0.8382868,1048,water treatment plant manager,0.8365842,1949,resource manager,0.83642244,1240,hydrogeologist,0.8289736,2002,drainage engineer,0.82814384,511,water quality analyst,0.82740635,2975,natural resources consultant,0.8201035,1937,sewerage systems manager,0.81980824,338,water treatment systems operator,0.8194881
11,Dam Safety Engineer (Independent dam safety panel),Dam safety engineering,Provide technical guidance on dam safety during project preparation and implementation.,['provide technical guidance on dam safety'],Two independent  panels -one for  environmental  and social safeguards  and another  for  dam  safety -are  in  place  and have provided  technical guidance  to the NELSAP Coordination Unit during  project preparation. This guidance  will  continue during project implementation.,P075941,3,127,Dam Safety Engineer (Independent dam safety panel) Dam safety engineering Provide technical guidance on dam safety during project preparation and implementation. provide technical guidance on dam safety,1967,health and safety engineer,0.83879375,2608,mine health and safety engineer,0.8332851,2002,drainage engineer,0.8295209,2616,civil engineer,0.82828426,1346,construction safety inspector,0.8279433,810,explosives engineer,0.82777834,3002,water engineer,0.8261161,533,construction engineer,0.8259771,2869,nuclear engineer,0.825438,247,water systems engineering technician,0.8252976
12,Environmental and Social Safeguards Expert (Independent panel),Environmental and social safeguards,Provide technical guidance on environmental and social safeguards during project preparation and implementation.,['provide technical guidance on environmental and social safeguards'],Two independent  panels -one for  environmental  and social safeguards  and another  for  dam  safety -are  in  place  and have provided  technical guidance  to the NELSAP Coordination Unit during  project preparation. This guidance  will  continue during project implementation.,P075941,3,128,Environmental and Social Safeguards Expert (Independent panel) Environmental and social safeguards Provide technical guidance on environmental and social safeguards during project preparation and implementation. provide technical guidance on environmental and social safeguards,928,environmental protection manager,0.84161866,2044,environmental expert,0.83904004,2103,environmental engineer,0.83810073,665,pipeline environmental project manager,0.83608687,2459,ICT environmental manager,0.8292125,1111,environmental programme coordinator,0.82884705,1095,health safety and environmental manager,0.82797945,440,green ICT consultant,0.8266926,1205,water conservation technician supervisor,0.8264156,2782,environmental technician,0.826408
13,Financial Management Specialist / Project Accountant (Project Implementation Unit),Financial management and reporting,Prepare quarterly implementation progress and financial reports and support financial monitoring and audits.,"['prepare quarterly implementation progress and financial reports', 'support financial monitoring and analysis']","This will  include quarterly implementation progress and financial reports by the  project RPIU  with  support from the  Owner's  Engineer, as  well  as  periodic technical and compliance  audits of  the environment  and  social risk mitigation measures.",P075941,3,129,"Financial Management Specialist / Project Accountant (Project Implementation Unit) Financial management and reporting Prepare quarterly implementation progress and financial reports and support financial monitoring and audits. prepare quarterly implementation progress and financial reports, support financial monitoring and analysis",70,accounting manager,0.85902345,1175,financial controller,0.8548599,2838,accountant,0.84927785,340,financial auditor,0.8435379,623,financial manager,0.84237576,1505,public finance accountant,0.83720815,2180,back office specialist,0.83655035,1958,financial fraud examiner,0.83583796,2478,accounting analyst,0.8338105,432,financial planner,0.8293642
14,Environmental Compliance Auditor,Environmental and social compliance auditing,Conduct periodic technical and compliance audits of environment and social risk mitigation measures.,['conduct periodic technical and compliance audits of the environment and social risk mitigation measures'],"This will  include quarterly implementation progress and financial reports by the  project RPIU  with  support from the  Owner's  Engineer, as  well  as  periodic technical and compliance  audits of  the environment  and  social risk mitigation measures.",P075941,3,130,Environmental Compliance Auditor Environmental and social compliance auditing Conduct periodic technical and compliance audits of environment and social risk mitigation measures. conduct periodic technical and compliance audits of the environment and social risk mitigation measures,1095,health safety and environmental manager,0.8405791,2459,ICT environmental manager,0.8361632,1111,environmental programme coordinator,0.8352854,928,environmental protection manager,0.8352199,2044,environmental expert,0.8294788,230,environmental scientist,0.8278946,1961,environmental health inspector,0.8276303,440,green ICT consultant,0.8242817,2782,environmental technician,0.8214617,1468,ICT auditor manager,0.8199113
15,Procurement Specialist (as defined in Project Implementation Manual),Project procurement and contract management,Develop and implement procurement procedures as set out in the Project Implementation Manual.,['implement procurement procedures'],"The Project Implementation Manual  shall include the  following  provisions: (a)  capacity  building  activities for sustained achievement  of  the  Project's objectives; (b) disbursement, financial management  and procurement  procedures; (c) institutional administration, coordination and day-to-day execution of activities of  the  Project; (d) monitoring, evaluation, reporting, information, education  and  communication; (e) Project  impact and  implementation  indicators, including the  procedures for  monitoring and evaluation of  the  Project activities; (f) the pertinent environmental and  social safeguard documents;  (h) the  format of  the  unaudited interim  financial reports  and  the Financial  Statements;  and  (i)  any  such  other administrative, financial, technical and organizational arrangements  and procedures as shall be required for  the  Project.",P075941,3,131,Procurement Specialist (as defined in Project Implementation Manual) Project procurement and contract management Develop and implement procurement procedures as set out in the Project Implementation Manual. implement procurement procedures,72,procurement category specialist,0.88347065,2486,public procurement specialist,0.8666884,565,contract manager,0.8644029,1790,procurement department manager,0.8543997,2473,procurement support officer,0.8499818,2084,supply chain manager,0.8437606,1635,contract engineer,0.8427942,2658,purchase planner,0.84175533,2647,category manager,0.8348448,1035,bid manager,0.83093727
16,Capacity Building Trainer (Project capacity building),Training and capacity building,Deliver capacity building activities to achieve the Project's objectives as specified in the Project Implementation Manual.,['deliver capacity building activities'],"The Project Implementation Manual  shall include the  following  provisions: (a)  capacity  building  activities for sustained achievement  of  the  Project's objectives; (b) disbursement, financial management  and procurement  procedures; (c) institutional administration, coordination and day-to-day execution of activities of  the  Project; (d) monitoring, evaluation, reporting, information, education  and  communication; (e) Project  impact and  implementation  indicators, including the  procedures for  monitoring and evaluation of  the  Project activities; (f) the pertinent environmental and  social safeguard documents;  (h) the  format of  the  unaudited interim  financial reports  and  the Financial  Statements;  and  (i)  any  such  other administrative, financial, technical and organizational arrangements  and procedures as shall be required for  the  Project.",P075941,3,132,Capacity Building Trainer (Project capacity building) Training and capacity building Deliver capacity building activities to achieve the Project's objectives as specified in the Project Implementation Manual. deliver capacity building activities,2933,personal trainer,0.836182,856,ICT capacity planner,0.83586764,150,corporate trainer,0.83012,1969,corporate training manager,0.8289592,163,quantity surveyor,0.82386863,2334,project manager,0.8237959,306,consultant social worker,0.8234538,1061,outdoor activities instructor,0.82208157,1156,project support officer,0.82136273,2465,programme manager,0.82105136
17,"Communications Specialist (Information, education and communication)",Project communications and stakeholder engagement,"Design and implement information, education and communication activities as part of project monitoring, evaluation and reporting.","['monitoring, evaluation, reporting, information, education and communication']","The Project Implementation Manual  shall include the  following  provisions: (a)  capacity  building  activities for sustained achievement  of  the  Project's objectives; (b) disbursement, financial management  and procurement  procedures; (c) institutional administration, coordination and day-to-day execution of activities of  the  Project; (d) monitoring, evaluation, reporting, information, education  and  communication; (e) Project  impact and  implementation  indicators, including the  procedures for  monitoring and evaluation of  the  Project activities; (f) the pertinent environmental and  social safeguard documents;  (h) the  format of  the  unaudited interim  financial reports  and  the Financial  Statements;  and  (i)  any  such  other administrative, financial, technical and organizational arrangements  and procedures as shall be required for  the  Project.",P075941,3,133,"Communications Specialist (Information, education and communication) Project communications and stakeholder engagement Design and implement information, education and communication activities as part of project monitoring, evaluation and reporting. monitoring, evaluation, reporting, information, education and communication",1668,warfare specialist,0.8402972,1941,public affairs consultant,0.8387609,895,communications lecturer,0.8324001,1125,educational researcher,0.8309789,1336,public relations manager,0.83094287,1745,technical communicator,0.8302608,2253,spokesperson,0.82636905,2507,communication manager,0.82571316,1614,monitoring and evaluation officer,0.82293445,2941,education policy officer,0.822652
1,Private hydropower plant operator,Hydropower plant operations,"Be contracted to operate the power plant, enforce Power Purchase Agreement obligations, and provide expertise to ensure safe and reliable dam operations.","['be contracted to operate the power plant', 'enforce Power Purchase Agreement obligations', 'provide expertise to ensure safe and reliable dam operations']","The Power Plant operations will  be contracted out  to  a competitivelyselected private operator, and this operator will receive the  delegated authority to  enforce the  PPA obligations. The operator will  also provide  the  necessary expertise to  ensure  safe  and reliable dam operations.",P075941,4,134,"Private hydropower plant operator Hydropower plant operations Be contracted to operate the power plant, enforce Power Purchase Agreement obligations, and provide expertise to ensure safe and reliable dam operations. be contracted to operate the power plant, enforce Power Purchase Agreement obligations, provide expertise to ensure safe and reliable dam operations",241,hydroelectric plant operator,0.8631644,1408,power production plant operator,0.8486133,2887,power plant control room operator,0.8471855,2388,geothermal power plant operator,0.841913,283,fossil-fuel power plant operator,0.8416334,1430,steam plant operator,0.8373791,2485,power plant manager,0.8362216,1351,solar power plant operator,0.8326273,2083,steam turbine operator,0.82921535,566,boiler operator,0.8290846
2,Owner's Engineer,Power plant and transmission project engineering oversight,"Support the RPIU and be responsible for overall project management and supervision of procurement, design, construction and preparation for operation and maintenance of the power plant complex and transmission lines; and coordinate implementation of ESMP and RAP.","['provide overall project management', 'supervision of the procurement', 'supervision of design', 'supervision of construction', 'prepare for operation and maintenance', 'coordinate implementation of the Environmental and Social Management Plan and Resettlement Action Plan']","The RPIU  will be  supported by the  Owner's  Engineer and will be  responsible for: (i)  overall project management and supervision of the procurement, design, construction and  preparation for operation  and  maintenance of  the power  plant  complex  and transmission lines; and  (ii) coordination of  the  implementation of  the  Environmental and Social Management  Plan (ESMP) and the Resettlement Action  Plan  (RAP).",P075941,4,135,"Owner's Engineer Power plant and transmission project engineering oversight Support the RPIU and be responsible for overall project management and supervision of procurement, design, construction and preparation for operation and maintenance of the power plant complex and transmission lines; and coordinate implementation of ESMP and RAP. provide overall project management, supervision of the procurement, supervision of design, supervision of construction, prepare for operation and maintenance, coordinate implementation of the Environmental and Social Management Plan and Resettlement Action Plan",2485,power plant manager,0.84414136,2887,power plant control room operator,0.83690035,1101,electric power generation engineer,0.82978344,1408,power production plant operator,0.8279477,384,power lines supervisor,0.8248228,241,hydroelectric plant operator,0.8242912,151,steam engineer,0.8223949,1470,commissioning engineer,0.8214592,2104,power distribution engineer,0.82034385,1036,process engineering technician,0.82024086
3,Procurement specialist,Project procurement,Supervise procurement activities for the project.,['supervision of the procurement'],"The RPIU  will be  supported by the  Owner's  Engineer and will be  responsible for: (i)  overall project management and supervision of the procurement, design, construction and  preparation for operation  and  maintenance of  the power  plant  complex  and transmission lines; and  (ii) coordination of  the  implementation of  the  Environmental and Social Management  Plan (ESMP) and the Resettlement Action  Plan  (RAP).",P075941,4,136,Procurement specialist Project procurement Supervise procurement activities for the project. supervision of the procurement,72,procurement category specialist,0.882878,2486,public procurement specialist,0.8788535,1790,procurement department manager,0.86507994,2473,procurement support officer,0.85970724,2084,supply chain manager,0.85742843,565,contract manager,0.85118043,699,purchasing manager,0.8435516,2658,purchase planner,0.84085155,2537,standalone public buyer,0.83961266,1035,bid manager,0.8387626
4,Power plant design engineer,Power plant design,Design the power plant complex as part of project supervision.,['supervision of design of the power plant complex'],"The RPIU  will be  supported by the  Owner's  Engineer and will be  responsible for: (i)  overall project management and supervision of the procurement, design, construction and  preparation for operation  and  maintenance of  the power  plant  complex  and transmission lines; and  (ii) coordination of  the  implementation of  the  Environmental and Social Management  Plan (ESMP) and the Resettlement Action  Plan  (RAP).",P075941,4,137,Power plant design engineer Power plant design Design the power plant complex as part of project supervision. supervision of design of the power plant complex,2485,power plant manager,0.87836814,1101,electric power generation engineer,0.86219805,2887,power plant control room operator,0.8573078,2104,power distribution engineer,0.8535643,405,energy systems engineer,0.8527165,2869,nuclear engineer,0.8523986,2710,hydropower engineer,0.84928334,151,steam engineer,0.84912753,2871,substation engineer,0.8485458,384,power lines supervisor,0.84836614
5,Transmission line design engineer,Transmission line design,Design the transmission lines as part of project supervision.,['supervision of design of the transmission lines'],"The RPIU  will be  supported by the  Owner's  Engineer and will be  responsible for: (i)  overall project management and supervision of the procurement, design, construction and  preparation for operation  and  maintenance of  the power  plant  complex  and transmission lines; and  (ii) coordination of  the  implementation of  the  Environmental and Social Management  Plan (ESMP) and the Resettlement Action  Plan  (RAP).",P075941,4,138,Transmission line design engineer Transmission line design Design the transmission lines as part of project supervision. supervision of design of the transmission lines,44,telecommunications engineer,0.8612977,1540,rolling stock engineer,0.85801077,384,power lines supervisor,0.8540319,2871,substation engineer,0.85370255,2085,transport engineer,0.8508624,2657,engine designer,0.84665704,1090,pipeline engineer,0.8457097,1456,railway electronic technician,0.8452545,1669,electrical engineer,0.84478796,2616,civil engineer,0.8443427
6,Construction supervisor,Construction of power plant and transmission lines,Supervise construction activities for the power plant complex and transmission lines.,['supervision of construction'],"The RPIU  will be  supported by the  Owner's  Engineer and will be  responsible for: (i)  overall project management and supervision of the procurement, design, construction and  preparation for operation  and  maintenance of  the power  plant  complex  and transmission lines; and  (ii) coordination of  the  implementation of  the  Environmental and Social Management  Plan (ESMP) and the Resettlement Action  Plan  (RAP).",P075941,4,139,Construction supervisor Construction of power plant and transmission lines Supervise construction activities for the power plant complex and transmission lines. supervision of construction,384,power lines supervisor,0.898144,2485,power plant manager,0.87610674,527,rail construction supervisor,0.87492895,79,bridge construction supervisor,0.87348807,1687,electrical supervisor,0.8718492,181,construction general supervisor,0.87094545,545,sewer construction supervisor,0.867138,1319,construction painting supervisor,0.8635014,587,construction scaffolding supervisor,0.86268437,2756,underwater construction supervisor,0.8621079
7,Operations and maintenance engineer,Power plant operations and maintenance readiness,Prepare the power plant complex and transmission lines for operation and maintenance.,['preparation for operation and maintenance'],"The RPIU  will be  supported by the  Owner's  Engineer and will be  responsible for: (i)  overall project management and supervision of the procurement, design, construction and  preparation for operation  and  maintenance of  the power  plant  complex  and transmission lines; and  (ii) coordination of  the  implementation of  the  Environmental and Social Management  Plan (ESMP) and the Resettlement Action  Plan  (RAP).",P075941,4,140,Operations and maintenance engineer Power plant operations and maintenance readiness Prepare the power plant complex and transmission lines for operation and maintenance. preparation for operation and maintenance,2887,power plant control room operator,0.87411726,1408,power production plant operator,0.86445546,2485,power plant manager,0.8559735,1430,steam plant operator,0.8555099,1211,maintenance and repair engineer,0.852152,241,hydroelectric plant operator,0.8506385,283,fossil-fuel power plant operator,0.8474345,1351,solar power plant operator,0.8469886,384,power lines supervisor,0.8467037,2083,steam turbine operator,0.8454485
8,Environmental and social safeguards specialist,Environmental and social safeguards implementation,Coordinate and implement the Environmental and Social Management Plan (ESMP).,['coordinate implementation of the Environmental and Social Management Plan (ESMP)'],"The RPIU  will be  supported by the  Owner's  Engineer and will be  responsible for: (i)  overall project management and supervision of the procurement, design, construction and  preparation for operation  and  maintenance of  the power  plant  complex  and transmission lines; and  (ii) coordination of  the  implementation of  the  Environmental and Social Management  Plan (ESMP) and the Resettlement Action  Plan  (RAP).",P075941,4,141,Environmental and social safeguards specialist Environmental and social safeguards implementation Coordinate and implement the Environmental and Social Management Plan (ESMP). coordinate implementation of the Environmental and Social Management Plan (ESMP),928,environmental protection manager,0.8650327,570,sustainability manager,0.8370588,1095,health safety and environmental manager,0.8315587,2103,environmental engineer,0.8299458,2044,environmental expert,0.8296268,665,pipeline environmental project manager,0.82784045,2367,social services manager,0.8274816,1250,rescue centre manager,0.8269681,1111,environmental programme coordinator,0.8259175,306,consultant social worker,0.82586217
9,Resettlement specialist,Resettlement planning and implementation,Coordinate and implement the Resettlement Action Plan (RAP).,['coordinate implementation of the Resettlement Action Plan (RAP)'],"The RPIU  will be  supported by the  Owner's  Engineer and will be  responsible for: (i)  overall project management and supervision of the procurement, design, construction and  preparation for operation  and  maintenance of  the power  plant  complex  and transmission lines; and  (ii) coordination of  the  implementation of  the  Environmental and Social Management  Plan (ESMP) and the Resettlement Action  Plan  (RAP).",P075941,4,142,Resettlement specialist Resettlement planning and implementation Coordinate and implement the Resettlement Action Plan (RAP). coordinate implementation of the Resettlement Action Plan (RAP),166,cyber incident responder,0.81721437,443,foreclosure specialist,0.8141545,986,strategic planning manager,0.8121054,1918,geographic information systems specialist,0.8119017,1755,smart city consultant,0.81176084,2658,purchase planner,0.81110656,846,land planner,0.8097806,1941,public affairs consultant,0.8089149,1157,public housing manager,0.80870485,1227,food production planner,0.8082106
