extraction_id,identified_occupation,industry,activity_description_in_pad,skills_needed_for_activity,source_material_quote,project_id,section_id,pad_id,combined_text,match_1_esco_id,match_1_occupation,match_1_score,match_2_esco_id,match_2_occupation,match_2_score,match_3_esco_id,match_3_occupation,match_3_score,match_4_esco_id,match_4_occupation,match_4_score,match_5_esco_id,match_5_occupation,match_5_score,match_6_esco_id,match_6_occupation,match_6_score,match_7_esco_id,match_7_occupation,match_7_score,match_8_esco_id,match_8_occupation,match_8_score,match_9_esco_id,match_9_occupation,match_9_score,match_10_esco_id,match_10_occupation,match_10_score
6,Mobile Crane Operator,Construction equipment operation for dam/intake works,Operate mobile crane to install and remove stop logs and other heavy elements during maintenance and construction,"['install stop logs by mobile crane', 'remove stop logs by mobile crane']","The stop logs,  of  the downstream-seal type, will  be used  to service the  intake  gates. The stop  logs  will  be installed and removed by a mobile  crane  and  will be stored nearby  for  easy  access.",P075941,7,184,"Mobile Crane Operator Construction equipment operation for dam/intake works Operate mobile crane to install and remove stop logs and other heavy elements during maintenance and construction install stop logs by mobile crane, remove stop logs by mobile crane",392,mobile crane operator,0.8764605,189,tower crane operator,0.86634386,2148,rigger,0.853931,1308,forestry equipment operator,0.8509152,379,production plant crane operator,0.84743035,2669,container crane operator,0.84717196,2170,crane crew supervisor,0.84367687,1087,concrete pump operator,0.8423145,2146,construction equipment technician,0.84084165,1174,debarker operator,0.84026444
7,Hoist Operator,Mechanical operations for intake gates,Operate hoist to raise and lower intake gates during normal operation and inspections,"['raise intake gates with hoist', 'lower intake gates with hoist']","A hoist located at  the  deck level, inside a protective housing, will raise and lower  the  intake gates.",P075941,7,185,"Hoist Operator Mechanical operations for intake gates Operate hoist to raise and lower intake gates during normal operation and inspections raise intake gates with hoist, lower intake gates with hoist",792,ski lift operator,0.84374064,1430,steam plant operator,0.8400207,2021,heat treatment furnace operator,0.83860236,2955,lift technician,0.8371615,566,boiler operator,0.8366008,2083,steam turbine operator,0.83464974,2976,desalination technician,0.8335011,379,production plant crane operator,0.8329662,998,injection moulding operator,0.8328441,1895,glass annealer,0.83230853
8,Trash Rack Installer,Intake mechanical installation and maintenance,Install trash-rack panels in intake recesses and facilitate removal for maintenance and inspection,"['install trash-rack panels in recesses', 'remove trash-rack panels for maintenance and inspection']","There  will be  three, equal-sized openings  in  the  face  of the  intake, each  containing a trash-rack panel. The trash racks  will  be installed in  recesses on the  sloping face  to allow them to be removed  for  maintenance and inspection.",P075941,7,186,"Trash Rack Installer Intake mechanical installation and maintenance Install trash-rack panels in intake recesses and facilitate removal for maintenance and inspection install trash-rack panels in recesses, remove trash-rack panels for maintenance and inspection",865,drain technician,0.81032884,190,refurbishing technician,0.8100693,999,street sweeper,0.80818474,3010,solid waste operator,0.80701494,2955,lift technician,0.8067383,2462,aircraft interior technician,0.8064358,2159,aircraft assembly inspector,0.8060665,2418,rolling stock assembly inspector,0.8055712,148,door installer,0.8046464,1662,deburring machine operator,0.8040857
9,Hydromechanical Fitter (Butterfly Valve Installer),Powerhouse mechanical installation,Fit butterfly valves ahead of spiral cases for each turbine unit,"['fit butterfly valve ahead of spiral case', 'install hydromechanical valve assemblies']","The powerhouse will  contain three  turbines (Kaplan  units) and three generators with  a  total maximum  capacity of  80MW. The rated flow  of each  turbine will be 119m 3 s-' for  a  total of 357m 3 S-. Ahead of  the  spiral cases, each  unit will be  fitted with  a  butterfly valve.",P075941,7,187,"Hydromechanical Fitter (Butterfly Valve Installer) Powerhouse mechanical installation Fit butterfly valves ahead of spiral cases for each turbine unit fit butterfly valve ahead of spiral case, install hydromechanical valve assemblies",52,aircraft engine assembler,0.82740116,1571,hydropower technician,0.82575107,1552,aircraft gas turbine engine overhaul technician,0.82549906,494,industrial machinery mechanic,0.8200885,1602,fluid power engineer,0.8182664,149,fluid power technician,0.81719637,241,hydroelectric plant operator,0.81684995,1692,vessel engine assembler,0.81471574,1702,fitter and turner,0.81321406,916,insulating tube winder,0.8113711
10,Penstock Steel Liner Welder/Installer,Penstock fabrication and installation,Install steel liner with concrete backing in penstocks close to the powerhouse to eliminate leakage and allow valve connections,"['install steel liner in penstock', 'weld steel liner and prepare concrete backing']","The penstocks are  concrete lined  in  the  first section, while  they  have a steel liner with concrete backing  in  the  second  section close  to  the powerhouse.  The steel lining of  the penstocks  is  required because  of  the  damage  caused  to  the  rock by the  blasting during excavation in  the  powerhouse.",P075941,7,188,"Penstock Steel Liner Welder/Installer Penstock fabrication and installation Install steel liner with concrete backing in penstocks close to the powerhouse to eliminate leakage and allow valve connections install steel liner in penstock, weld steel liner and prepare concrete backing",1349,brazier,0.8210194,1307,structural ironworker,0.8160546,2063,concrete finisher,0.8148924,1177,boilermaker,0.8113617,604,pipe welder,0.81117487,2405,ornamental metal worker,0.8097896,2185,rustproofer,0.80674696,417,concrete finisher supervisor,0.80428517,1203,stamping press operator,0.8027794,1122,cylinder filler,0.80270797
11,Geotechnical Driller,Geotechnical investigation,Excavate inclined boreholes in the rock mass at the top of the powerhouse for fault characterization,"['excavate inclined boreholes', 'collect subsurface samples for fault characterization']","During the  detailed design  of the  powerhouse,  several inclined boreholes will be excavated  in  the rock  mass at  the  top of  the powerhouse in  order  to characterize the location and nature  of  the fault.",P075941,7,189,"Geotechnical Driller Geotechnical investigation Excavate inclined boreholes in the rock mass at the top of the powerhouse for fault characterization excavate inclined boreholes, collect subsurface samples for fault characterization",2856,mining geotechnical engineer,0.82950723,689,driller,0.82392263,2795,geotechnician,0.8236781,2629,mud logger,0.82218385,2064,geophysicist,0.8178457,356,geological engineer,0.81654906,1648,soil surveying technician,0.81644535,870,well-digger,0.8161198,2423,geologist,0.81526387,802,drilling engineer,0.8128401
12,Geotechnical Engineer,Geotechnical investigation and analysis,Characterize the location and nature of faults based on borehole data,"['characterize location and nature of fault', 'interpret inclined borehole data']","During the  detailed design  of the  powerhouse,  several inclined boreholes will be excavated  in  the rock  mass at  the  top of  the powerhouse in  order  to characterize the location and nature  of  the fault.",P075941,7,190,"Geotechnical Engineer Geotechnical investigation and analysis Characterize the location and nature of faults based on borehole data characterize location and nature of fault, interpret inclined borehole data",356,geological engineer,0.8524966,2856,mining geotechnical engineer,0.8445298,2064,geophysicist,0.8332364,2423,geologist,0.83083063,199,civil engineering technician,0.82326335,1648,soil surveying technician,0.8217236,2332,geothermal engineer,0.81876683,2629,mud logger,0.8185704,2795,geotechnician,0.81804836,2454,geochemist,0.81618905
13,Hydraulic Modeler (Hydraulic Engineer),Hydraulic studies and model testing for dam/intake,Investigate potential vortex formation and maximum discharge capacity through a physical hydraulic model study,"['investigate potential vortex formation', 'conduct physical hydraulic model study']","The POEDS on Dam  Safety has  advised that the  potential of  vortex formation, maximum  discharge capacity, and how to prevent it be investigated further during the  physical hydraulic model study, which  is to  be  undertaken during the  detailed  esign.",P075941,7,191,"Hydraulic Modeler (Hydraulic Engineer) Hydraulic studies and model testing for dam/intake Investigate potential vortex formation and maximum discharge capacity through a physical hydraulic model study investigate potential vortex formation, conduct physical hydraulic model study",3002,water engineer,0.83199275,2002,drainage engineer,0.8301824,1602,fluid power engineer,0.82818854,2710,hydropower engineer,0.82757854,1944,aerodynamics engineer,0.8241662,149,fluid power technician,0.82345355,839,hydrographic surveyor,0.8192042,1240,hydrogeologist,0.81914115,1812,container equipment design engineer,0.81911606,1053,hydrologist,0.81810415
14,Road Construction Engineer,Roadway construction adjacent to dam/spillway,Construct a new two-lane roadway on the upstream side of the dam/spillway structures and provide access for operations,"['construct two-lane roadway', 'provide roadway access for dam operations and maintenance']","A new two-lane roadway  will be constructed on  the  upstream  side of  the  dam/spillway structures. Upon completion of the  Project, part  of the  traffic passing on  the existing bridge  can be  diverted  over this  new  roadway.",P075941,7,192,"Road Construction Engineer Roadway construction adjacent to dam/spillway Construct a new two-lane roadway on the upstream side of the dam/spillway structures and provide access for operations construct two-lane roadway, provide roadway access for dam operations and maintenance",873,civil engineering worker,0.82789814,1440,sewer construction worker,0.8196553,533,construction engineer,0.81880164,2085,transport engineer,0.8184939,2002,drainage engineer,0.8183501,1185,road construction worker,0.8159753,434,waterway construction labourer,0.8140975,2616,civil engineer,0.81240404,802,drilling engineer,0.81073475,1090,pipeline engineer,0.8103939
15,Diversion Works Design Engineer,River diversion and cofferdam design,Finalize the design of diversion works including diversion channel and cofferdam,"['finalize design of diversion works', 'design diversion channel and cofferdam']","However, the  analysis has shown that constructing the  diversion tunnel  scheme would cost  more than  double  the  canal  scheme.  Therefore, temporary  diversion of  the  river during  construction is  planned, to  be achieved  at  least cost  through  the  open-cut  canal excavated  in  the  left abutment  of  the dam. The contractor will  finalize the  design  of diversion works.",P075941,7,193,"Diversion Works Design Engineer River diversion and cofferdam design Finalize the design of diversion works including diversion channel and cofferdam finalize design of diversion works, design diversion channel and cofferdam",2002,drainage engineer,0.8392416,1732,industrial tool design engineer,0.82989776,1857,wastewater engineer,0.8289132,2085,transport engineer,0.8262799,1812,container equipment design engineer,0.82203496,1090,pipeline engineer,0.82176226,2616,civil engineer,0.82171154,3002,water engineer,0.82000095,796,rail project engineer,0.8181157,533,construction engineer,0.8172809
16,Project Implementation Unit Engineer,Project assessment and design coordination,Conduct detailed assessments and implement design modifications in coordination with stakeholders,"['conduct a detailed assessment', 'implement design modifications']","The project will involve major  changes  to the  road  configuration on  both  sides of the  river and  construction of  new customs  and immigration facilities. The Rusumo PIU and  Owner's  Engineer will conduct  a  detailed assessment and  design  modifications, such as  river diversion arrangements, as  required, in  close  coordination with  GoT, GoR  and JICA to  ensure smooth implementation of the  Rusumo  Falls hydropower  project.",P075941,7,194,"Project Implementation Unit Engineer Project assessment and design coordination Conduct detailed assessments and implement design modifications in coordination with stakeholders conduct a detailed assessment, implement design modifications",399,component engineer,0.8372207,1893,precision engineer,0.82473016,1380,design engineer,0.8230195,533,construction engineer,0.82277167,2990,calculation engineer,0.82197344,110,integration engineer,0.81970406,1732,industrial tool design engineer,0.8193366,3018,application engineer,0.81482315,1099,installation engineer,0.8141378,2616,civil engineer,0.8136643
17,Owner's Engineer,Project supervision and design review,Conduct detailed assessments and design modifications to support project implementation,"['conduct a detailed assessment', 'design modifications']","The project will involve major  changes  to the  road  configuration on  both  sides of the  river and  construction of  new customs  and immigration facilities. The Rusumo PIU and  Owner's  Engineer will conduct  a  detailed assessment and  design  modifications, such as  river diversion arrangements, as  required, in  close  coordination with  GoT, GoR  and JICA to  ensure smooth implementation of the  Rusumo  Falls hydropower  project.",P075941,7,195,"Owner's Engineer Project supervision and design review Conduct detailed assessments and design modifications to support project implementation conduct a detailed assessment, design modifications",533,construction engineer,0.8372431,1380,design engineer,0.83328617,399,component engineer,0.8313654,2990,calculation engineer,0.8292174,2616,civil engineer,0.8279468,3018,application engineer,0.8264762,1732,industrial tool design engineer,0.82599735,1754,automotive engineer,0.8247849,796,rail project engineer,0.822604,676,wood technology engineer,0.8219838
18,High Voltage Transmission Line Installer,High-voltage transmission connection,Install transmission lines connecting the transformers at the powerhouse to the substation,"['connect transmission lines from transformers to substation', 'install high-voltage transmission lines']",The transmission lines from  the  transformers will  connect the  powerhouse  to  the substation.,P075941,7,196,"High Voltage Transmission Line Installer High-voltage transmission connection Install transmission lines connecting the transformers at the powerhouse to the substation connect transmission lines from transformers to substation, install high-voltage transmission lines",1387,overhead line worker,0.8467046,2452,electricity distribution technician,0.8419894,156,cable jointer,0.8381915,384,power lines supervisor,0.8349307,2871,substation engineer,0.8348442,1442,electrical power distributor,0.82839584,1547,electrical transmission system operator,0.82479835,2104,power distribution engineer,0.8232143,646,building electrician,0.8130877,2883,street lighting electrician,0.81228894
1,Project Manager (Rusumo Project Implementation Unit),Hydroelectric power plant construction and project implementation,Project management and unit leadership for project implementation,"['head the Unit', 'ensure timely, quality, project implementation']","The Unit's oversight capability will be reinforced with a Project Manager as head of the Unit, senior project engineers (civil, electrical and mechanical), a quantity surveyor, environment and social specialists, a procurement specialist, a financial-management specialist, an accounts-and-logistics assistant, a communications specialist and other technical staff.",P075941,8,197,"Project Manager (Rusumo Project Implementation Unit) Hydroelectric power plant construction and project implementation Project management and unit leadership for project implementation head the Unit, ensure timely, quality, project implementation",2485,power plant manager,0.8384405,2334,project manager,0.83750844,1725,ICT project manager,0.83462846,2887,power plant control room operator,0.8281826,1408,power production plant operator,0.8226062,1048,water treatment plant manager,0.8191748,2083,steam turbine operator,0.81806386,241,hydroelectric plant operator,0.81784225,1156,project support officer,0.8177656,85,oil and gas production manager,0.81631184
2,Senior Civil Engineer (Rusumo Project Implementation Unit),Hydroelectric power plant construction and civil works,Senior civil engineering input for project implementation,['senior project engineering (civil)'],"The Unit's oversight capability will be reinforced with a Project Manager as head of the Unit, senior project engineers (civil, electrical and mechanical), a quantity surveyor, environment and social specialists, a procurement specialist, a financial-management specialist, an accounts-and-logistics assistant, a communications specialist and other technical staff.",P075941,8,198,Senior Civil Engineer (Rusumo Project Implementation Unit) Hydroelectric power plant construction and civil works Senior civil engineering input for project implementation senior project engineering (civil),2616,civil engineer,0.8324054,873,civil engineering worker,0.82739586,2117,"mining, construction and civil engineering machinery distribution manager",0.8199122,1652,"import export manager in mining, construction and civil engineering machinery",0.8199031,199,civil engineering technician,0.81733084,2272,"import export specialist in mining, construction, civil engineering machinery",0.8172945,241,hydroelectric plant operator,0.816918,1762,rental service representative in construction and civil engineering machinery,0.8138237,2710,hydropower engineer,0.81102616,1101,electric power generation engineer,0.8092896
3,Senior Electrical Engineer (Rusumo Project Implementation Unit),Hydroelectric power plant electro-mechanical works and substation,Senior electrical engineering input for project implementation,['senior project engineering (electrical)'],"The Unit's oversight capability will be reinforced with a Project Manager as head of the Unit, senior project engineers (civil, electrical and mechanical), a quantity surveyor, environment and social specialists, a procurement specialist, a financial-management specialist, an accounts-and-logistics assistant, a communications specialist and other technical staff.",P075941,8,199,Senior Electrical Engineer (Rusumo Project Implementation Unit) Hydroelectric power plant electro-mechanical works and substation Senior electrical engineering input for project implementation senior project engineering (electrical),2871,substation engineer,0.83213323,241,hydroelectric plant operator,0.8252101,1101,electric power generation engineer,0.82274467,2887,power plant control room operator,0.8218803,1408,power production plant operator,0.8193774,1669,electrical engineer,0.81488204,2485,power plant manager,0.8141638,2710,hydropower engineer,0.8121221,1571,hydropower technician,0.8088311,2104,power distribution engineer,0.80665493
4,Senior Mechanical Engineer (Rusumo Project Implementation Unit),Hydroelectric power plant mechanical systems and equipment,Senior mechanical engineering input for project implementation,['senior project engineering (mechanical)'],"The Unit's oversight capability will be reinforced with a Project Manager as head of the Unit, senior project engineers (civil, electrical and mechanical), a quantity surveyor, environment and social specialists, a procurement specialist, a financial-management specialist, an accounts-and-logistics assistant, a communications specialist and other technical staff.",P075941,8,200,Senior Mechanical Engineer (Rusumo Project Implementation Unit) Hydroelectric power plant mechanical systems and equipment Senior mechanical engineering input for project implementation senior project engineering (mechanical),241,hydroelectric plant operator,0.83734477,707,mechanical engineering drafter,0.82560384,1571,hydropower technician,0.8244138,1085,mechanical engineer,0.8238802,2710,hydropower engineer,0.8220692,1408,power production plant operator,0.8215485,2887,power plant control room operator,0.8176919,359,equipment engineer,0.816945,1490,electromechanical engineer,0.8154433,149,fluid power technician,0.8149162
5,Quantity Surveyor,Construction cost control and contract management,Cost estimation and quantity surveying for construction packages,['quantity surveying'],"The Unit's oversight capability will be reinforced with a Project Manager as head of the Unit, senior project engineers (civil, electrical and mechanical), a quantity surveyor, environment and social specialists, a procurement specialist, a financial-management specialist, an accounts-and-logistics assistant, a communications specialist and other technical staff.",P075941,8,201,Quantity Surveyor Construction cost control and contract management Cost estimation and quantity surveying for construction packages quantity surveying,163,quantity surveyor,0.9111459,2979,construction manager,0.8629564,2273,construction general contractor,0.83355296,2626,land surveyor,0.8308254,1035,bid manager,0.8229152,1228,surveying technician,0.81903446,2117,"mining, construction and civil engineering machinery distribution manager",0.81409657,899,wood and construction materials distribution manager,0.8134829,1645,cost analyst,0.81256676,638,construction quality manager,0.81226766
6,Environmental Specialist,Environmental and social safeguards,Environmental assessment and implementation of ESMP activities,['environmental specialist'],"The Unit's oversight capability will be reinforced with a Project Manager as head of the Unit, senior project engineers (civil, electrical and mechanical), a quantity surveyor, environment and social specialists, a procurement specialist, a financial-management specialist, an accounts-and-logistics assistant, a communications specialist and other technical staff.",P075941,8,202,Environmental Specialist Environmental and social safeguards Environmental assessment and implementation of ESMP activities environmental specialist,928,environmental protection manager,0.8885797,2103,environmental engineer,0.8615854,2044,environmental expert,0.86101776,2347,aquaculture environmental analyst,0.84715927,570,sustainability manager,0.84704506,1111,environmental programme coordinator,0.8455634,230,environmental scientist,0.8440547,665,pipeline environmental project manager,0.8434609,227,environmental education officer,0.8421011,636,environmental mining engineer,0.8408246
7,Social Specialist,"Social safeguards, resettlement and livelihood restoration",Social assessment and implementation of RAP and LADP activities,['social specialist'],"The Unit's oversight capability will be reinforced with a Project Manager as head of the Unit, senior project engineers (civil, electrical and mechanical), a quantity surveyor, environment and social specialists, a procurement specialist, a financial-management specialist, an accounts-and-logistics assistant, a communications specialist and other technical staff.",P075941,8,203,"Social Specialist Social safeguards, resettlement and livelihood restoration Social assessment and implementation of RAP and LADP activities social specialist",2609,social services policy officer,0.83625245,329,social service consultant,0.8351238,2666,rehabilitation support worker,0.8342519,306,consultant social worker,0.8278184,1909,criminal justice social worker,0.82738304,2235,social work supervisor,0.8262557,2070,migrant social worker,0.82382286,2962,recreational therapist,0.82075834,2607,substance misuse worker,0.81918293,926,social worker,0.8188489
8,Procurement Specialist (Nile Equatorial Lakes Subsidiary Action Program Coordination Unit),Procurement and contract administration,"Manage procurement for goods, works and consulting services under the project",['procurement specialist'],"The Unit's oversight capability will be reinforced with a Project Manager as head of the Unit, senior project engineers (civil, electrical and mechanical), a quantity surveyor, environment and social specialists, a procurement specialist, a financial-management specialist, an accounts-and-logistics assistant, a communications specialist and other technical staff.",P075941,8,204,"Procurement Specialist (Nile Equatorial Lakes Subsidiary Action Program Coordination Unit) Procurement and contract administration Manage procurement for goods, works and consulting services under the project procurement specialist",72,procurement category specialist,0.8583848,1790,procurement department manager,0.84468335,2486,public procurement specialist,0.83213174,565,contract manager,0.8232832,2084,supply chain manager,0.8202065,2473,procurement support officer,0.8164034,2537,standalone public buyer,0.8161663,2658,purchase planner,0.8155833,699,purchasing manager,0.81359076,2647,category manager,0.8118806
