extraction_id,identified_occupation,industry,activity_description_in_pad,skills_needed_for_activity,source_material_quote,project_id,section_id,pad_id,combined_text,match_1_esco_id,match_1_occupation,match_1_score,match_2_esco_id,match_2_occupation,match_2_score,match_3_esco_id,match_3_occupation,match_3_score,match_4_esco_id,match_4_occupation,match_4_score,match_5_esco_id,match_5_occupation,match_5_score,match_6_esco_id,match_6_occupation,match_6_score,match_7_esco_id,match_7_occupation,match_7_score,match_8_esco_id,match_8_occupation,match_8_score,match_9_esco_id,match_9_occupation,match_9_score,match_10_esco_id,match_10_occupation,match_10_score
1,Transmission Line Construction Engineer,Construction of high-voltage transmission lines,"the construction of various transmission lines underway, scheduled for commissioning by 2014","['construction of transmission lines', 'commissioning of transmission lines']","the construction of various transmission lines underway,  scheduled for commissioning by 2014.",P075941,0,0,"Transmission Line Construction Engineer Construction of high-voltage transmission lines the construction of various transmission lines underway, scheduled for commissioning by 2014 construction of transmission lines, commissioning of transmission lines",1387,overhead line worker,0.84681356,2452,electricity distribution technician,0.83814824,384,power lines supervisor,0.83773327,2871,substation engineer,0.83725023,1547,electrical transmission system operator,0.8342337,1101,electric power generation engineer,0.8309206,1090,pipeline engineer,0.82545346,1749,belt builder,0.8254266,1456,railway electronic technician,0.8248798,1470,commissioning engineer,0.82351637
2,Power Plant Rehabilitation Engineer,Rehabilitation of existing power plants,rehabilitation of existing power plants,['rehabilitation of existing power plants'],"the CAS calls for  the  rehabilitation f  existing power plants, the  construction of  new plants, the  development  of  a rural electrification program  to  address the  country's severe energy  shortfall, and Burundi's participation i the  EAPP.",P075941,0,1,Power Plant Rehabilitation Engineer Rehabilitation of existing power plants rehabilitation of existing power plants rehabilitation of existing power plants,1101,electric power generation engineer,0.8614967,1408,power production plant operator,0.85693765,2887,power plant control room operator,0.8564261,2485,power plant manager,0.8559131,2104,power distribution engineer,0.8530097,241,hydroelectric plant operator,0.8508246,405,energy systems engineer,0.8484677,187,renewable energy engineer,0.8481741,283,fossil-fuel power plant operator,0.8480743,151,steam engineer,0.8471211
3,Hydropower Plant Construction Engineer,Construction of hydropower plants,construction of new power plants,['construction of new plants'],"the CAS calls for  the  rehabilitation f  existing power plants, the  construction of  new plants, the  development  of  a rural electrification program  to  address the  country's severe energy  shortfall, and Burundi's participation i the  EAPP.",P075941,0,2,Hydropower Plant Construction Engineer Construction of hydropower plants construction of new power plants construction of new plants,2710,hydropower engineer,0.8801091,1101,electric power generation engineer,0.8633119,3002,water engineer,0.86184835,241,hydroelectric plant operator,0.86025274,2485,power plant manager,0.85631096,1571,hydropower technician,0.8551227,533,construction engineer,0.85284424,1602,fluid power engineer,0.8523233,187,renewable energy engineer,0.8492783,2178,energy engineer,0.84845626
4,Rural Electrification Program Coordinator,Rural electrification program development,development of a rural electrification program to address the country's severe energy shortfall,['development of a rural electrification program'],"the CAS calls for  the  rehabilitation f  existing power plants, the  construction of  new plants, the  development  of  a rural electrification program  to  address the  country's severe energy  shortfall, and Burundi's participation i the  EAPP.",P075941,0,3,Rural Electrification Program Coordinator Rural electrification program development development of a rural electrification program to address the country's severe energy shortfall development of a rural electrification program,866,electricity and energy vocational teacher,0.80631137,2685,energy consultant,0.7991922,1940,economic development coordinator,0.7966048,2555,education programme coordinator,0.7957924,222,renewable energy consultant,0.7927789,2485,power plant manager,0.7899029,1415,emergency response coordinator,0.78876626,1529,sports programme coordinator,0.7887604,1111,environmental programme coordinator,0.7885522,3009,solar energy sales consultant,0.7884928
5,Power System Planning Engineer,Regional power system planning and feasibility assessment,assessment of economic and engineering feasibility of power development options,"['assessment of economic feasibility', 'assessment of engineering feasibility']","The CBWS has prepared a Regional Power Development Strategy that suggests power development options, including an assessment of their economic and engineering feasibility as well as environmental and social impacts.",P075941,0,4,"Power System Planning Engineer Regional power system planning and feasibility assessment assessment of economic and engineering feasibility of power development options assessment of economic feasibility, assessment of engineering feasibility",1101,electric power generation engineer,0.85588914,2178,energy engineer,0.8532957,405,energy systems engineer,0.8526677,2104,power distribution engineer,0.85153705,2710,hydropower engineer,0.84549755,151,steam engineer,0.8452146,187,renewable energy engineer,0.8447831,1669,electrical engineer,0.8420843,2137,thermal engineer,0.8415606,2871,substation engineer,0.838068
6,Environmental and Social Impact Assessment Specialist,Environmental and social impact assessment for power projects,assessment of environmental and social impacts of power development options,"['assessment of environmental impacts', 'assessment of social impacts']","The CBWS has prepared a Regional Power Development Strategy that suggests power development options, including an assessment of their economic and engineering feasibility as well as environmental and social impacts.",P075941,0,5,"Environmental and Social Impact Assessment Specialist Environmental and social impact assessment for power projects assessment of environmental and social impacts of power development options assessment of environmental impacts, assessment of social impacts",928,environmental protection manager,0.84801805,2044,environmental expert,0.83209515,665,pipeline environmental project manager,0.82699525,2103,environmental engineer,0.8267824,2178,energy engineer,0.8217368,2347,aquaculture environmental analyst,0.8204309,2104,power distribution engineer,0.8173529,306,consultant social worker,0.81729215,2609,social services policy officer,0.81583947,570,sustainability manager,0.8150931
7,Power System Interconnection Engineer,Power system interconnections and grid integration,build important power system interconnections to form the transmission backbone linking beneficiary countries,"['build power system interconnections', 'form transmission backbone']","The Project will also build important power system interconnections, which will help form the transmission backbone linking Burundi, Rwanda, and Tanzania.",P075941,0,6,"Power System Interconnection Engineer Power system interconnections and grid integration build important power system interconnections to form the transmission backbone linking beneficiary countries build power system interconnections, form transmission backbone",2104,power distribution engineer,0.8435383,1101,electric power generation engineer,0.84267867,1547,electrical transmission system operator,0.8404711,405,energy systems engineer,0.83700836,1669,electrical engineer,0.83089685,2871,substation engineer,0.8263058,187,renewable energy engineer,0.8254287,1578,power electronics engineer,0.824649,44,telecommunications engineer,0.8219557,1534,gas distribution engineer,0.8209833
8,Project Development Specialist (regional program),Project development under regional subsidiary action program,develop the Project under the regional framework of the Nile Equatorial Lakes Subsidiary Action Program,['develop the Project under the regional framework'],The Project is being developed under the regional framework of the Nile Equatorial Lakes Subsidiary Action Program (NELSAP).,P075941,0,7,Project Development Specialist (regional program) Project development under regional subsidiary action program develop the Project under the regional framework of the Nile Equatorial Lakes Subsidiary Action Program develop the Project under the regional framework,510,regional development policy officer,0.8205405,2412,botanicals specialist,0.8022654,342,chemical application specialist,0.80118144,118,branch manager,0.79774845,2112,specialist biomedical scientist,0.7970754,928,environmental protection manager,0.79659814,1918,geographic information systems specialist,0.79455864,1529,sports programme coordinator,0.7929189,141,aircraft engine specialist,0.7920836,2161,database developer,0.7920518
9,Transmission Expansion Planner,Expansion of generation and transmission links,increasing regional generation and transmission links to help meet regional electricity demand,"['increase regional generation links', 'increase transmission links']",The Project will play a critical role in increasing regional generation and transmission links to help meet regional electricity demand.,P075941,0,8,"Transmission Expansion Planner Expansion of generation and transmission links increasing regional generation and transmission links to help meet regional electricity demand increase regional generation links, increase transmission links",1547,electrical transmission system operator,0.8270352,1101,electric power generation engineer,0.8205309,2104,power distribution engineer,0.81668997,2452,electricity distribution technician,0.8108522,2485,power plant manager,0.81059265,945,electricity sales representative,0.808775,384,power lines supervisor,0.8072742,1669,electrical engineer,0.80643606,1814,transport planner,0.8051467,3009,solar energy sales consultant,0.80346525
10,Energy Economist,Energy sector economic and financial analysis,determine best regional options taking into account economic and financial considerations,"['assess economic considerations', 'assess financial considerations']","These assessments have determined  the best  regional options for meeting future electricity demand, taking into  account  economic,  financial, technical, environmental, social  and political considerations.",P075941,0,9,"Energy Economist Energy sector economic and financial analysis determine best regional options taking into account economic and financial considerations assess economic considerations, assess financial considerations",2494,energy analyst,0.836848,129,domestic energy assessor,0.8311057,1757,financial analyst,0.82405823,2245,investment analyst,0.82186353,393,energy trader,0.8203763,1072,economic adviser,0.8202809,2685,energy consultant,0.8197516,1892,economist,0.8170613,717,economic policy officer,0.8168042,2178,energy engineer,0.8158315
1,Tariff Analyst,Tariff setting and financial analysis for power plant,Calculate tariffs needed for the Rusumo Power Company Limited to remain financially viable over the lifetime of the power plant based on annual revenue requirements.,"['calculate tariffs based on annual revenue requirements', ""assess financial viability of the power company's operations""]","The financial analysis has assessed the  financial viability of  the  Project from the  investor/owner perspective. Based on the  annual  revenue  requirements of  the Rusumo  Power Company  Limited  (RPCL), the  analysis calculated the  tariffs needed for  the company's  operations to  remain financially viable  over  the lifetime of  the power plant.",P075941,10,10,"Tariff Analyst Tariff setting and financial analysis for power plant Calculate tariffs needed for the Rusumo Power Company Limited to remain financially viable over the lifetime of the power plant based on annual revenue requirements. calculate tariffs based on annual revenue requirements, assess financial viability of the power company's operations",1408,power production plant operator,0.822433,500,middle office analyst,0.82034445,2887,power plant control room operator,0.8162432,970,budget analyst,0.81478477,283,fossil-fuel power plant operator,0.8130552,2083,steam turbine operator,0.8124875,1757,financial analyst,0.8124307,1430,steam plant operator,0.8122361,2485,power plant manager,0.8115772,2195,tax policy analyst,0.81150055
2,Legal Counsel (Power Purchase Agreements),Power purchase agreement legal services,Draft and include financial security arrangements (escrow deposits and guarantees) in power purchase agreements between off-takers and Rusumo Power Company Limited.,"['draft Power Purchase Agreement clauses requiring deposit and maintenance of escrow amounts', 'incorporate financial security arrangements into PPAs']","- (a) The utilities under  the  Power Purchase  Agreement shall each  deposit and maintain an  amount equal to  six  months'  capacity charges, pursuant to  the Power  Purchase  Agreement  in an  escrow account with a  depository satisfactory to RPCL.  Each of  the  Utilities hall provide one-third of  the required amount six (6) months prior the  Commercial Operations Date  of the Project, and  thereafter, provide periodic  replenishments for the duration of  Power Purchase Agreement;  and",P075941,10,11,"Legal Counsel (Power Purchase Agreements) Power purchase agreement legal services Draft and include financial security arrangements (escrow deposits and guarantees) in power purchase agreements between off-takers and Rusumo Power Company Limited. draft Power Purchase Agreement clauses requiring deposit and maintenance of escrow amounts, incorporate financial security arrangements into PPAs",945,electricity sales representative,0.8076524,2685,energy consultant,0.8040829,474,electrical drafter,0.8023164,2262,property developer,0.8016559,2887,power plant control room operator,0.8016509,3027,renewable energy sales representative,0.8000728,2258,property acquisitions manager,0.7989458,2351,financial broker,0.79868406,1408,power production plant operator,0.79567814,129,domestic energy assessor,0.7940335
3,Bank Escrow Account Manager,Bank escrow account management,Operate and manage the escrow account holding off-taker security deposits under supervision of an independent third party.,"['operate escrow account', 'manage escrow deposits and withdrawals under independent supervision']",it is recommended that each of the three utilities provide RPCL  with  a  banker's guarantee or  a security deposit in  a  bank escrow  account  equivalent to  six  months of  capacity charges. The value  of  the  guarantee/deposit will be reviewed  annually to  account  for any expected  variations in the  capacity charges  during  the  subsequent year.  Each beneficiary country would be expected  to  provide  one-third of  this requirement. The escrow account  would be operated  under  the  supervision of  an independent  third party.,P075941,10,12,"Bank Escrow Account Manager Bank escrow account management Operate and manage the escrow account holding off-taker security deposits under supervision of an independent third party. operate escrow account, manage escrow deposits and withdrawals under independent supervision",1173,bank account manager,0.84866333,1449,bank manager,0.84558594,2635,relationship banking manager,0.8317687,605,bank teller,0.8305365,2411,banking products manager,0.8297683,1175,financial controller,0.82535446,2228,bank treasurer,0.8249339,1943,central bank governor,0.8246945,588,sales account manager,0.82323116,2726,asset manager,0.820477
4,Utility Treasury Manager,Utility treasury management,Deposit and maintain in an escrow account an amount equal to six months' capacity charges and provide periodic replenishments as required under the PPA.,"[""deposit and maintain escrow funds equivalent to six months' capacity charges"", 'provide periodic replenishments to the escrow account']","- (a) The utilities under  the  Power Purchase  Agreement shall each  deposit and maintain an  amount equal to  six  months'  capacity charges, pursuant to  the Power  Purchase  Agreement  in an  escrow account with a  depository satisfactory to RPCL.  Each of  the  Utilities hall provide one-third of  the required amount six (6) months prior the  Commercial Operations Date  of the Project, and  thereafter, provide periodic  replenishments for the duration of  Power Purchase Agreement;  and",P075941,10,13,"Utility Treasury Manager Utility treasury management Deposit and maintain in an escrow account an amount equal to six months' capacity charges and provide periodic replenishments as required under the PPA. deposit and maintain escrow funds equivalent to six months' capacity charges, provide periodic replenishments to the escrow account",2279,billing clerk,0.810122,1505,public finance accountant,0.80811405,2228,bank treasurer,0.80343115,2389,bookkeeper,0.80061734,1943,central bank governor,0.79726905,783,corporate treasurer,0.79671633,684,financial markets back office administrator,0.7958101,1173,bank account manager,0.79381764,2961,pre-lasting operator,0.7932,642,credit manager,0.79317254
5,Financial Manager (Rusumo Power Company Limited),Company financial management for power company,Draw down escrow funds to meet operational costs and suspend debt service payments under the Subsidiary Agreement if off-taker utilities fail to make required payments.,"['drawdown equivalent amounts from the escrow account to meet operational costs', 'suspend payment(s) of debt service under the Subsidiary Agreement when utilities have failed to make required payments']","(b) If at  any time  the  Utilities shall have failed to  make  a required payment under  the  Power Purchase  Agreement,  RPCL  shall be entitled to  suspend payment(s)  of  debt service  under the Subsidiary Agreement  until the Utility(ies) shall  have satisfied in full  all  payments under the Power Purchase  Agreement and replenished the  escrow account, during  which period the  RPCL  may drawdown  the  equivalent amounts from  the  escrow account  in  order to  meet  its operational costs.",P075941,10,14,"Financial Manager (Rusumo Power Company Limited) Company financial management for power company Draw down escrow funds to meet operational costs and suspend debt service payments under the Subsidiary Agreement if off-taker utilities fail to make required payments. drawdown equivalent amounts from the escrow account to meet operational costs, suspend payment(s) of debt service under the Subsidiary Agreement when utilities have failed to make required payments",623,financial manager,0.8164,642,credit manager,0.81541324,309,spark erosion machine operator,0.81509304,1004,debt collector,0.81412995,1523,financial risk manager,0.8138906,1449,bank manager,0.81257284,684,financial markets back office administrator,0.81135815,1175,financial controller,0.80986255,2887,power plant control room operator,0.80812234,70,accounting manager,0.8072188
6,Project Developer,Project development studies for carbon finance,Conduct required studies to enhance the project's financial outlook and position it to benefit from a future carbon market.,"[""conduct required studies to enhance the Project's financial outlook"", 'prepare project documentation to qualify for carbon market credentials']","Nevertheless, in order  to benefit from a future carbon market, the project developers will conduct  the  required studies to  enhance  the Project's financial outlook.",P075941,10,15,"Project Developer Project development studies for carbon finance Conduct required studies to enhance the project's financial outlook and position it to benefit from a future carbon market. conduct required studies to enhance the Project's financial outlook, prepare project documentation to qualify for carbon market credentials",665,pipeline environmental project manager,0.8287597,2238,business developer,0.81941044,2262,property developer,0.81711245,222,renewable energy consultant,0.81523895,2979,construction manager,0.8127793,2194,credit risk analyst,0.81155723,1757,financial analyst,0.81077206,2570,wholesale merchant in wood and construction materials,0.8106968,1175,financial controller,0.8093403,181,construction general supervisor,0.8089572
7,Plant Availability Monitoring Engineer,Plant performance monitoring and availability verification,"Monitor and demonstrate hydro plant availability (e.g., 97% availability factor) to trigger capacity charge payments and support adjustments if availability targets are not met.","['demonstrate hydro plant availability factor (e.g., 97%)', 'monitor plant availability and report on compliance with PPA availability targets']","The off-takers will  pay  this charge  as  long  as RPCL can demonstrate that the  hydro  plant has  an availability factor 97%, or  any other  level of  availability o  be  agreed  upon by the contracting parties, even if  the  power is  not  dispatched. The capacity charge  will be adjusted if  the availability target is  not  achieved.",P075941,10,16,"Plant Availability Monitoring Engineer Plant performance monitoring and availability verification Monitor and demonstrate hydro plant availability (e.g., 97% availability factor) to trigger capacity charge payments and support adjustments if availability targets are not met. demonstrate hydro plant availability factor (e.g., 97%), monitor plant availability and report on compliance with PPA availability targets",1048,water treatment plant manager,0.8348498,241,hydroelectric plant operator,0.8328822,1580,water plant technician,0.8272316,1470,commissioning engineer,0.8264692,2485,power plant manager,0.8233583,2887,power plant control room operator,0.82119715,1430,steam plant operator,0.8211849,879,gas processing plant control room operator,0.8187962,1408,power production plant operator,0.8177291,338,water treatment systems operator,0.8175329
8,Reserve Fund Manager (Rusumo Power Company Limited),Reserve fund management for major rehabilitation,"Manage the build-up of a reserve for major rehabilitation costs over a specified period through the company's capacity charge, starting in Year 21 of operations.","['manage build-up of major rehabilitation reserve through capacity charge', 'plan timing and accumulation of reserve starting in Year 21 of operations']","Under  the  Base  Case,  a  reserve for  the major  rehabilitation costs will  be built-up over five years prior to  start of  the rehabilitation through the  company's  capacity charge. The  build-up of  the  reserve will start in  Year  21 of  operations, which is  also the  year  following the  final repayment  of debt.",P075941,10,17,"Reserve Fund Manager (Rusumo Power Company Limited) Reserve fund management for major rehabilitation Manage the build-up of a reserve for major rehabilitation costs over a specified period through the company's capacity charge, starting in Year 21 of operations. manage build-up of major rehabilitation reserve through capacity charge, plan timing and accumulation of reserve starting in Year 21 of operations",2666,rehabilitation support worker,0.8206396,1949,resource manager,0.81212085,1476,recreational facilities manager,0.80970293,2485,power plant manager,0.80543065,2961,pre-lasting operator,0.80520105,623,financial manager,0.8036485,986,strategic planning manager,0.8031473,2069,ICT resilience manager,0.8023168,1048,water treatment plant manager,0.8021796,70,accounting manager,0.8021651
9,Power Purchase Agreement Specialist,Power purchase agreement design and negotiation,"Design power purchase agreements to ensure the Rusumo Power Company Limited can meet its financial obligations reflected in the planned tariff structure, including take-or-pay capacity charges.","['design Power Purchase Agreements to ensure company can meet financial obligations', 'structure take-or-pay capacity charge provisions']","Power purchase agreements (PPAs). The PPA's will  be designed to ensure that RPCL  will be  able to  meet  the  financial obligations reflected in  the  planned  tariff structure. The initial term  of the  PPAs  between  RPCL  and the  three off-takers will ideally be  a  ""take-or-pay"" contract for 25 years.",P075941,10,18,"Power Purchase Agreement Specialist Power purchase agreement design and negotiation Design power purchase agreements to ensure the Rusumo Power Company Limited can meet its financial obligations reflected in the planned tariff structure, including take-or-pay capacity charges. design Power Purchase Agreements to ensure company can meet financial obligations, structure take-or-pay capacity charge provisions",2658,purchase planner,0.82280934,72,procurement category specialist,0.8218262,945,electricity sales representative,0.8165497,699,purchasing manager,0.81510586,474,electrical drafter,0.8115693,2285,ICT buyer,0.8112242,2486,public procurement specialist,0.8073151,524,purchaser,0.80689865,2537,standalone public buyer,0.8064647,1004,debt collector,0.8058722
